2018,基幹理工学部,最適化と認識・学習 【前年度成績S評価者用】,小林　哲則,秋学期  無その他,専門必修,3,2,"",西早稲田（旧大久保）,日本語,情報学,知的システム,一般,上級レベル,講義,false,false,秋学期,なし,なし,なし,なし,なし
2018,基幹理工学部,情報通信実験C,小川　哲司／甲藤　二郎／亀山　渉／小林　哲則／佐藤　拓朗／嶋本　薫／高畑　文雄／田中　良明／戸川　望／中里　秀則／前原　文明／森　達哉／渡辺　裕,秋学期  水1-2,専門必修,3,2,63号館3階端末室Gルーム,西早稲田（旧大久保）,日本語,電気電子工学,電気電子工学,通信・ネットワーク工学,上級レベル,実習／実験／実技,false,false,秋学期,3,1,63号館3階端末室Gルーム,なし,なし
2018,基幹理工学部,情報通信実験C,小川　哲司／甲藤　二郎／亀山　渉／小林　哲則／佐藤　拓朗／嶋本　薫／高畑　文雄／田中　良明／戸川　望／中里　秀則／前原　文明／森　達哉／渡辺　裕,秋学期  水1-2,専門必修,3,2,63号館3階端末室Gルーム,西早稲田（旧大久保）,日本語,電気電子工学,電気電子工学,通信・ネットワーク工学,上級レベル,実習／実験／実技,false,false,秋学期,3,2,63号館3階端末室Gルーム,なし,なし
2018,基幹理工学部,情報通信実験C 【前年度成績S評価者用】,小川　哲司／甲藤　二郎／亀山　渉／小林　哲則／佐藤　拓朗／嶋本　薫／高畑　文雄／田中　良明／戸川　望／中里　秀則／前原　文明／森　達哉／渡辺　裕,秋学期  無その他,専門必修,3,2,"",西早稲田（旧大久保）,日本語,電気電子工学,電気電子工学,通信・ネットワーク工学,上級レベル,実習／実験／実技,false,false,秋学期,なし,なし,なし,なし,なし
2018,基幹理工学部,卒業論文A,石川　博／上田　和紀／内田　真人／小川　哲司／笠原　博徳／甲藤　二郎／亀山　渉／木村　啓二／小林　哲則／後藤　滋樹／酒井　哲也／佐藤　拓朗／嶋本　薫／清水　佳奈／菅原　俊治／高畑　文雄／田中　良明／寺内　多智弘／戸川　望／中里　秀則／中島　達夫／深澤　良彰／前原　文明／森　達哉／山名　早人／鷲崎　弘宜／渡辺　裕,通年  無その他,専門必修,4,4,"",西早稲田（旧大久保）,日本語,情報学,総合,一般,総仕上げ,論文,false,false,通年,なし,なし,なし,なし,なし
2018,基幹理工学部,卒業論文A　　【前年度成績S評価者用】,石川　博／上田　和紀／内田　真人／小川　哲司／笠原　博徳／甲藤　二郎／亀山　渉／木村　啓二／小林　哲則／後藤　滋樹／酒井　哲也／佐藤　拓朗／嶋本　薫／清水　佳奈／菅原　俊治／高畑　文雄／田中　良明／寺内　多智弘／戸川　望／中里　秀則／中島　達夫／深澤　良彰／前原　文明／森　達哉／山名　早人／鷲崎　弘宜／渡辺　裕,通年  無その他,専門必修,4,4,"",西早稲田（旧大久保）,日本語,情報学,総合,一般,総仕上げ,論文,false,false,通年,なし,なし,なし,なし,なし
2018,基幹理工学部,卒業論文B,石川　博／上田　和紀／内田　真人／小川　哲司／笠原　博徳／甲藤　二郎／亀山　渉／木村　啓二／小林　哲則／後藤　滋樹／酒井　哲也／佐藤　拓朗／嶋本　薫／清水　佳奈／菅原　俊治／高畑　文雄／田中　良明／寺内　多智弘／戸川　望／中里　秀則／中島　達夫／深澤　良彰／前原　文明／森　達哉／山名　早人／鷲崎　弘宜／渡辺　裕,通年  無その他,専門必修,4,4,"",西早稲田（旧大久保）,日本語,情報学,総合,一般,総仕上げ,論文,false,false,通年,なし,なし,なし,なし,なし
2018,基幹理工学部,卒業論文B　　【前年度成績S評価者用】,石川　博／上田　和紀／内田　真人／小川　哲司／笠原　博徳／甲藤　二郎／亀山　渉／木村　啓二／小林　哲則／後藤　滋樹／酒井　哲也／佐藤　拓朗／嶋本　薫／清水　佳奈／菅原　俊治／高畑　文雄／田中　良明／寺内　多智弘／戸川　望／中里　秀則／中島　達夫／深澤　良彰／前原　文明／森　達哉／山名　早人／鷲崎　弘宜／渡辺　裕,通年  無その他,専門必修,4,4,"",西早稲田（旧大久保）,日本語,情報学,総合,一般,総仕上げ,論文,false,false,通年,なし,なし,なし,なし,なし
2018,基幹理工学部,情報数学A,石川　博／杉本　晃宏,春学期  火5時限,専門選択,2,2,63-201教室,西早稲田（旧大久保）,日本語,情報学,アルゴリズムと複雑性,一般,中級レベル（発展・応用）,講義,false,false,春学期,2,5,63-201教室,"マイケル シプサ (著) 「計算理論の基礎 [原著第2版] 1.オートマトンと言語」 共立出版.
富田悦次・横森貴「オートマトン・言語理論」森北出版, 1992.
ISBN-10: 4627805500, ISBN-13: 978-4627805507

論理学に関しては必要に応じて資料を配付する。","[{""name""=>""試験"", ""rate""=>""90％"", ""detail""=>""第15回に試験を実施する。""}, {""name""=>""レポート"", ""rate""=>""5％"", ""detail""=>""適宜レポート課題を課す。""}, {""name""=>""平常点評価"", ""rate""=>""5％"", ""detail""=>""適宜小テストを実施する。""}]"
2018,基幹理工学部,アルゴリズムとデータ構造A,浅谷　公威,春学期  木2時限,専門選択,2,2,56-103教室,西早稲田（旧大久保）,日本語,情報学,アルゴリズムと複雑性,一般,中級レベル（発展・応用）,講義,false,false,春学期,4,2,56-103教室,"R.Sedgewick, Algorithms in C, Parts 1-4: Fundamentals, Data Structures, Sorting, Searching (3rd Edition), Addison-Wesley, 1997. ISBN:978-0201314526",なし
2018,基幹理工学部,言語処理系,笠原　博徳／木村　啓二／吉田　明正,春学期  金5時限,専門選択,3,2,52-302教室,西早稲田（旧大久保）,日本語,情報学,プログラミング言語,一般,中級レベル（発展・応用）,講義,false,false,春学期,5,5,52-302教室,"・A. V. Aho他著，原田 賢一訳，コンパイラー原理・技法・ツール〈1〉，サイエンス社，1990
・A. V. Aho他著，原田 賢一訳，コンパイラー原理・技法・ツール〈2〉，サイエンス社，1990
・（原著）Alfred V. Aho, Ravi Sethi, Jeffrey D. Ullman, Compilers - principles, techniques and tools, Addison-Wesley, 1986.

教科書は非常に大部であり，この講義でその内容すべてを詳説することはできない。具体的な毎回の講義内容については，CourseN@viを参照のこと。","[{""name""=>""試験"", ""rate""=>""50％"", ""detail""=>""前半(フロントエンド）部分と後半(ミドルパス・バックエンド)部分とに分けて2度理解度の確認(試験)を行う。それぞれの結果は25%に重みづけ，合わせて50%として扱う。""}, {""name""=>""平常点評価"", ""rate""=>""50％"", ""detail""=>""レポート，小テスト，実習の成果を評価する。前半部分・後半部分それぞれを25%に重みづけ，合わせて50%として扱う。""}]"
2018,基幹理工学部,情報数学B,石川　博／杉本　晃宏,秋学期  火5時限,専門選択,2,2,52-302教室,西早稲田（旧大久保）,日本語,情報学,アルゴリズムと複雑性,一般,中級レベル（発展・応用）,講義,false,false,秋学期,2,5,52-302教室,特に指定しない。,"[{""name""=>""試験"", ""rate""=>""90％"", ""detail""=>""第15回に試験を実施する。""}, {""name""=>""レポート"", ""rate""=>""5％"", ""detail""=>""適宜レポート課題を課す。""}, {""name""=>""平常点評価"", ""rate""=>""5％"", ""detail""=>""適宜小テストを実施する。""}, {""name""=>""その他"", ""rate""=>""0％"", ""detail""=>""特になし""}]"
2018,基幹理工学部,アルゴリズムとデータ構造B,シモセラ　エドガー,秋学期  金4時限,専門選択,2,2,63-202教室,西早稲田（旧大久保）,日本語,情報学,アルゴリズムと複雑性,一般,中級レベル（発展・応用）,講義,false,false,秋学期,5,4,63-202教室,"R.Sedgewick, Algorithms in C, Parts 1-4: Fundamentals, Data Structures, Sorting, Searching (3rd Edition), Addison-Wesley, 1997. ISBN:978-0201314526",なし
2018,基幹理工学部,情報系の生命学,富永　大介／野口　保／山名　早人,秋学期  水2時限,専門選択,2,2,63-202教室,西早稲田（旧大久保）,日本語,情報学,その他,一般,中級レベル（発展・応用）,講義,false,false,秋学期,3,2,63-202教室,なし,"[{""name""=>""試験"", ""rate""=>""100％"", ""detail""=>""教場試験（15週目の授業時間中に試験）を実施し理解度の確認を行う。""}]"
2018,基幹理工学部,確率・統計概論,菅原　俊治,春学期  火2時限,専門選択,2,2,52-102教室,西早稲田（旧大久保）,日本語,情報学,離散構造,一般,中級レベル（発展・応用）,講義,false,false,春学期,2,2,52-102教室,統計学入門、東京大学教養学部統計学教室編　東京大学出版会,"[{""name""=>""試験"", ""rate""=>""60％"", ""detail""=>""定期試験（理解度確認）""}, {""name""=>""レポート"", ""rate""=>""30％"", ""detail""=>""レポート（もしくは教場での小テスト）。レポートは1−2回予定。""}, {""name""=>""平常点評価"", ""rate""=>""10％"", ""detail""=>""コースナビでの課題、資料のダウンロード時刻などを総合して評価する""}]"
2018,基幹理工学部,情報理論B,小林　哲則／俵　直弘,春学期  木2時限,専門選択,3,2,54-204教室,西早稲田（旧大久保）,日本語,電気電子工学,電気電子工学,通信・ネットワーク工学,上級レベル,講義,false,false,春学期,4,2,54-204教室,なし,なし
2018,基幹理工学部,ソフトウェア工学A,深澤　良彰／鷲崎　弘宜,春学期  金2時限,専門選択,3,2,63-202教室,西早稲田（旧大久保）,日本語,情報学,ソフトウェア工学,一般,上級レベル,講義,false,false,春学期,5,2,63-202教室,なし,なし
2018,基幹理工学部,プログラミングB,上田　和紀,春学期  火3時限,専門選択,3,2,56-103教室,西早稲田（旧大久保）,日本語,情報学,プログラミング言語,一般,上級レベル,講義,false,false,春学期,2,3,56-103教室,"（参考書）

五十嵐淳，プログラミング in OCaml　〜関数型プログラミングの基礎からGUI構築まで〜．
技術評論社，2012（電子版）
https://gihyo.jp/dp/ebook/2012/978-4-7741-5314-8

Randal E. Bryant and David R. O'Hallaron, Computer Systems: A Programmer's Perspective, 3rd Edition.
Pearson Education, 2015, ISBN13: 9780134092669.
http://csapp.cs.cmu.edu/",なし
2018,基幹理工学部,高性能計算,福井　義成,秋学期  金3時限,専門選択,3,2,63号館3階端末室Cルーム,西早稲田（旧大久保）,日本語,情報学,総合,一般,上級レベル,実習／実験／実技,false,false,秋学期,5,3,63号館3階端末室Cルーム,指定なし,"[{""name""=>""レポート"", ""rate""=>""70％"", ""detail""=>""・正しく動作するプログラムを作成できているか。\n・高性能なプログラムを作成できているか。""}, {""name""=>""平常点評価"", ""rate""=>""30％"", ""detail""=>""・講義内容を理解できているか。\n・実習中に正しくプログラミングできているか。""}]"
2018,基幹理工学部,IT経営プロジェクト基礎,山戸　昭三／鷲崎　弘宜,集中（春・秋学期）  無その他,専門選択,3,2,53-101教室,西早稲田（旧大久保）,日本語,情報学,社会問題と実践,一般,上級レベル,講義,false,false,集中（春・秋学期）,なし,なし,なし,講師が事前に、コースナビに掲載する。,なし
2018,基幹理工学部,システム開発プロジェクト基礎,大久保　雅司／鷲崎　弘宜,集中（春・秋学期）  無その他,専門選択,3,2,54-101教室,西早稲田（旧大久保）,日本語,情報学,プラットフォームベース開発,一般,上級レベル,講義,false,false,集中（春・秋学期）,なし,なし,なし,なし,"[{""name""=>""平常点評価"", ""rate""=>""40％"", ""detail""=>""演習や発表への取り組み（30-50%ほど）""}, {""name""=>""その他"", ""rate""=>""60％"", ""detail""=>""演習成果物、学習ジャーナル（50-70%ほど）""}]"
2018,基幹理工学部,コンピュータアーキテクチャB,笠原　博徳／木村　啓二／小高　剛,秋学期  水3時限,専門選択,3,2,52-304教室,西早稲田（旧大久保）,日本語,情報学,アーキテクチャと計算機構成,一般,上級レベル,講義,false,false,秋学期,3,3,52-304教室,なし,"[{""name""=>""試験"", ""rate""=>"""", ""detail""=>""成績は、講義中に行う演習、実習、レポート、出席及び定期試験等の総合的な評価により決定する""}, {""name""=>""レポート"", ""rate""=>"""", ""detail""=>""成績は、講義中に行う演習、実習、レポート、出席及び定期試験等の総合的な評価により決定する""}, {""name""=>""平常点評価"", ""rate""=>"""", ""detail""=>""成績は、講義中に行う演習、実習、レポート、出席及び定期試験等の総合的な評価により決定する""}]"
2018,基幹理工学部,プログラミングC,酒井　哲也／鷲崎　弘宜,秋学期  火3時限,専門選択,3,2,52-301教室,西早稲田（旧大久保）,日本語,情報学,プログラミング言語,一般,上級レベル,講義,false,false,秋学期,2,3,52-301教室,"",なし
2018,基幹理工学部,プログラミング言語,上田　和紀／寺内　多智弘,秋学期  火2時限,専門選択,3,2,52-302教室,西早稲田（旧大久保）,日本語,情報学,プログラミング言語,一般,上級レベル,講義,false,false,秋学期,2,2,52-302教室,なし,なし
2018,基幹理工学部,データベース,酒井　哲也,秋学期  月2時限,専門選択,3,2,56-103教室,西早稲田（旧大久保）,英語,情報学,情報管理,一般,総仕上げ,講義,false,false,秋学期,1,2,56-103教室,"Garcia-Molina et al.: Database Systems: The Complete Book (2nd edition), Pearson Education, 2009.",なし
2018,基幹理工学部,ソフトウェア工学B,萩本　順三／平鍋　健児／深澤　良彰／鷲崎　弘宜,秋学期  水5時限,専門選択,3,2,52-304教室,西早稲田（旧大久保）,日本語,情報学,ソフトウェア工学,一般,上級レベル,講義,false,false,秋学期,3,5,52-304教室,なし,なし
2018,基幹理工学部,サイバー攻撃対策技術の基礎,秋山　満昭／内田　真人／後藤　滋樹／森　達哉／八木　毅,秋学期  金4時限,専門選択,3,2,52-102教室,西早稲田（旧大久保）,日本語,情報学,情報保全とセキュリティ,一般,上級レベル,講義,false,false,秋学期,5,4,52-102教室,"著者名：八木毅、秋山満昭、村山純一
書籍名：コンピュータネットワークセキュリティ
出版社：コロナ社, 2015.
http://www.coronasha.co.jp/np/isbn/9784339024951/","[{""name""=>""試験"", ""rate""=>""40％"", ""detail""=>""第16週の試験により、理解度を評価する。""}, {""name""=>""レポート"", ""rate""=>""40％"", ""detail""=>""レポート課題を2回に分けて出題する。""}, {""name""=>""平常点評価"", ""rate""=>""20％"", ""detail""=>""出席回数を評価する。""}]"
2018,基幹理工学部,光通信技術,松島　裕一,春学期  木4時限,専門選択,3,2,52-302教室,西早稲田（旧大久保）,日本語,電気電子工学,電気電子工学,通信・ネットワーク工学,上級レベル,講義,false,false,春学期,4,4,52-302教室,資料は講義中に利用するスライド（コースナビに掲載）、および適時参考文献等を提示,"[{""name""=>""試験"", ""rate""=>""50％"", ""detail""=>""第15回目の授業時間中に試験を実施し、授業の内容について理解度の確認を行います。""}, {""name""=>""レポート"", ""rate""=>""30％"", ""detail""=>""小テスト、復習課題レポートを数回実施して理解度の進捗を確認します。""}, {""name""=>""平常点評価"", ""rate""=>""20％"", ""detail""=>""講義への出席、質問など積極性を評価します。""}]"
2018,基幹理工学部,無線通信技術,嶋本　薫,春学期  火4時限,専門選択,3,2,52-302教室,西早稲田（旧大久保）,日本語,電気電子工学,電気電子工学,通信・ネットワーク工学,上級レベル,講義,false,false,春学期,2,4,52-302教室,なし,"[{""name""=>""試験"", ""rate""=>""80％"", ""detail""=>""中間理解度確認と、最終の理解度確認試験を行う。""}, {""name""=>""レポート"", ""rate""=>""20％"", ""detail""=>""時間軸でのALOHA方式、TDMA方式のシミュレーションを行う。""}]"
2018,基幹理工学部,プロジェクト研究A,石川　博／上田　和紀／内田　真人／小川　哲司／笠原　博徳／甲藤　二郎／亀山　渉／木村　啓二／小林　哲則／後藤　滋樹／酒井　哲也／佐藤　拓朗／嶋本　薫／清水　佳奈／菅原　俊治／高畑　文雄／田中　良明／寺内　多智弘／戸川　望／中里　秀則／中島　達夫／深澤　良彰／前原　文明／森　達哉／山名　早人／鷲崎　弘宜／渡辺　裕,春学期  無その他,専門選択,3,2,"",西早稲田（旧大久保）,日本語,情報学,計算科学,一般,上級レベル,研究指導,false,false,春学期,なし,なし,なし,なし,なし
2018,基幹理工学部,次世代ネットワーク,井上　武／原井　洋明,秋学期  金5時限,専門選択,3,2,52-103教室,西早稲田（旧大久保）,日本語,情報学,ネットワークと通信,一般,上級レベル,講義,false,false,秋学期,5,5,52-103教室,なし,"[{""name""=>""試験"", ""rate""=>""50％"", ""detail""=>""試験により評価 (理由を問わず追試なし)""}, {""name""=>""平常点評価"", ""rate""=>""50％"", ""detail""=>""出席状況・レポート等により評価""}]"
2018,基幹理工学部,ディジタル放送技術,藤崎　好英／森本　聡,秋学期  月5時限,専門選択,3,2,56-103教室,西早稲田（旧大久保）,日本語,電気電子工学,電気電子工学,通信・ネットワーク工学,上級レベル,講義,false,false,秋学期,1,5,56-103教室,なし,"[{""name""=>""試験"", ""rate""=>""90％"", ""detail""=>""試験により評価""}, {""name""=>""平常点評価"", ""rate""=>""10％"", ""detail""=>""出席状況等により評価""}]"
2018,基幹理工学部,衛星通信技術,小松　大実／細川　瑞彦,秋学期  水5時限,専門選択,3,2,52-303教室,西早稲田（旧大久保）,日本語,電気電子工学,電気電子工学,通信・ネットワーク工学,上級レベル,講義,false,false,秋学期,3,5,52-303教室,"特に指定しない。授業中に配布する資料を用いて講義を進める。
必要に応じて授業中に紹介する。たとえば下記の書籍は参考となる文献である。","[{""name""=>""試験"", ""rate""=>""90％"", ""detail""=>""試験により評価""}, {""name""=>""平常点評価"", ""rate""=>""10％"", ""detail""=>""出席状況等により評価""}]"
2018,基幹理工学部,移動通信技術,大関　武雄／岸山　祥久／前原　文明,秋学期  金4時限,専門選択,3,2,53-103教室,西早稲田（旧大久保）,日本語,電気電子工学,電気電子工学,通信・ネットワーク工学,上級レベル,講義,false,false,秋学期,5,4,53-103教室,なし,なし
2018,基幹理工学部,コミュニケーション品質理論,矢守　恭子,秋学期  火3時限,専門選択,3,2,52-303教室,西早稲田（旧大久保）,日本語,電気電子工学,電気電子工学,通信・ネットワーク工学,上級レベル,講義,false,false,秋学期,2,3,52-303教室,なし,なし
2018,基幹理工学部,プロジェクト研究B,石川　博／上田　和紀／内田　真人／小川　哲司／笠原　博徳／甲藤　二郎／亀山　渉／木村　啓二／小林　哲則／後藤　滋樹／酒井　哲也／佐藤　拓朗／嶋本　薫／清水　佳奈／菅原　俊治／高畑　文雄／田中　良明／寺内　多智弘／戸川　望／中里　秀則／中島　達夫／深澤　良彰／前原　文明／森　達哉／山名　早人／鷲崎　弘宜／渡辺　裕,秋学期  無その他,専門選択,3,2,"",西早稲田（旧大久保）,日本語,情報学,計算科学,一般,上級レベル,研究指導,false,false,秋学期,なし,なし,なし,なし,なし
2018,基幹理工学部,オペレーティングシステムB,内田　真人／中島　達夫,秋学期  月5時限,専門選択,3,2,53-103教室,西早稲田（旧大久保）,日本語,情報学,オペレーティングシステム,一般,上級レベル,講義,false,false,秋学期,1,5,53-103教室,講義にて資料配布,なし
2018,基幹理工学部,情報社会論,太田　啓路／園田　智也／深澤　良彰,秋学期  木5時限,専門選択,3,2,52-101教室,西早稲田（旧大久保）,日本語,情報学,社会問題と実践,一般,上級レベル,講義,false,false,秋学期,4,5,52-101教室,・予習復習のための配布資料は、内容を要約したレジュメとして毎回CourseN@viに掲載する。,なし
2018,基幹理工学部,IoTシステム設計,笠原　博徳／木村　啓二／戸川　望／柳澤　政生／山名　早人,春学期  木5-6,専門選択,3,3,52-301教室,西早稲田（旧大久保）,日本語,情報学,アーキテクチャと計算機構成,一般,上級レベル,実習／実験／実技,false,false,春学期,4,5,52-301教室,毎回の資料を配布する,なし
2018,基幹理工学部,IoTシステム設計,笠原　博徳／木村　啓二／戸川　望／柳澤　政生／山名　早人,春学期  木5-6,専門選択,3,3,52-301教室,西早稲田（旧大久保）,日本語,情報学,アーキテクチャと計算機構成,一般,上級レベル,実習／実験／実技,false,false,春学期,4,6,52-301教室,毎回の資料を配布する,なし
2018,基幹理工学部,人工知能A,菅原　俊治,春学期  火4時限,専門選択,3,2,52-204教室,西早稲田（旧大久保）,日本語,情報学,知的システム,一般,上級レベル,講義,false,false,春学期,2,4,52-204教室,使わないが、参考書を初回の講義で紹介する。,"[{""name""=>""試験"", ""rate""=>""70％"", ""detail""=>""定期試験。基本的な内容が獲得できているかを確認します。\n（場合によっては、中間で教場試験を行う可能性もあります）。""}, {""name""=>""レポート"", ""rate""=>""25％"", ""detail""=>""実験・演習（プログラム作成）を中心にレポートを書き、その結果について確認する。""}, {""name""=>""平常点評価"", ""rate""=>""5％"", ""detail""=>""出席や資料のダウンロードの履歴などを参考にする。""}]"
2018,基幹理工学部,人工知能B,上田　和紀,秋学期  水2時限,専門選択,3,2,54-103教室,西早稲田（旧大久保）,日本語,情報学,知的システム,一般,上級レベル,講義,false,false,秋学期,3,2,54-103教室,なし,なし
2018,基幹理工学部,コンテンツ流通技術,亀山　渉,秋学期  月2時限,専門選択,4,2,53-103教室,西早稲田（旧大久保）,日本語,情報学,情報システムの基礎,一般,総仕上げ,講義,false,false,秋学期,1,2,53-103教室,特に指定しない。,"[{""name""=>""試験"", ""rate""=>""100％"", ""detail""=>""理解度の確認及び学習した内容の点検と確認の状況から評価する。""}]"
2018,基幹理工学部,ネットワークサービスとビジネスモデル,大津　徹／亀山　渉／三本松　憲生／中村　寛,春学期  金5時限,専門選択,4,2,53-B04教室,西早稲田（旧大久保）,日本語,情報学,社会問題と実践,一般,総仕上げ,講義,false,false,春学期,5,5,53-B04教室,なし。,"[{""name""=>""レポート"", ""rate""=>""100％"", ""detail""=>""与えられた演習課題を講義内容の視点と絡めて深く考察しているかどうかを評価する。""}]"
